{"allowed_origins":["files.pythonhosted.org:443","pypi.org:443"],"base_attempt_id":"SYNTHETIC_QUALIFICATION_RESTRICTED_A","candidate_only":true,"canonical_state_sha256":"05d2c438618b647aadcc687274352e0ca62b743d92dbed7ae14ecddf711cc2fa","client_authorization_evidence_sha256":"bccbb8054fb5f3a92969078c69d613f306a2cf560a31efe24d46bad8f6b80415","client_authorization_policy_sha256":"792f21cfa8aa24fd3211cd06c3e9dfe9190e5740796975354923a4a5beff04b1","client_authorization_verdict":"SYNTHETIC_CLIENT_AUTHORIZATION_PASS","controller_source_sha256":"93696b9a6e6fa7bd3c207c27e0b6c098bd1d68aa8781167edc4c74bc9cc5de41","enforcement_identity":"8801637324b2fa32124df8444e88f193a5be3f9c847904f2eebfb92197bc5c10","event_3_id":"a1108334362cd04f58ac33db7c16257fff49152d1b46f8c2d34719891f18aa98","network_mode":"RESTRICTED_DEFAULT","production_runtime_effectivity_pin_sha256":"d13dee3217dfb34391bd9e3f2db8c69125a567f51e042a1d3dd1d8d1ff515316","provider_independent_freshness_required":true,"provider_source_sha256":"8731a0ab7eb8605201b754c366b601c9f821e5eaa8c2d52204bbcdab8eaf809c","receipt_contract_sha256":"03ac2cb65e4a6122fdf89bd9fdc423fec386331eea8e243a7d728a13815b3c80","runtime_authority":false,"schema":"V6_RESTRICTED_BUILD_EGRESS_ENFORCEMENT_RECEIPT_V2_CANDIDATE","security_projection_sha256":"50a41f3bafaaef0695e03f557d1be314a854c409826638e8099bd1da023064b7","work_item_identity":{"base_attempt_id":"SYNTHETIC_QUALIFICATION_RESTRICTED_A","base_image_reference":"docker.io/library/python@sha256:ba23c4870854aa0718113e8765e7f46acbf141c6be1e66957ddcf130bd88d59d","base_runtime_sha256":"507cc8aa2fd9230f6007958c6075cdd2a38fc5bac34683676810df834009db0a","build_network_required":true,"case_id":"SYNTHETIC_RESTRICTED_A","census_order":1,"current_descriptor":{"path":"evaluation/downstream_benchmark/v6_current_state.json","sha256":"6a9028c79aa62f90db2b2d53def32ab23bffcfa3c71d2ec30d7fa64e741e3aae"},"derived_dependency_sha256":"4b8187328643c42c597f897d83ef4555b941a0438c415c06282f982c3635c682","engine_recipe_sha256":"0af4b25eac2f4aee52002b52aa6b0c73026f924a612bf79a0925ea2f2714e483","environment_mode":"SOURCE_INDEPENDENT_ENVIRONMENT","frozen_rank":29,"input_bindings":{"projects/scrapy/bugs/22/bug.info":"d43482c0c20dba01333b84dc33567aaeb9bae650e758be81ec88ef952e5b27d0","projects/scrapy/bugs/22/requirements.txt":"82a99ce0849dc6c4505aa1ddede486df40e9ba4c8b8a09fe3ae02574d5276590","projects/scrapy/bugs/22/run_test.sh":"15da3a3df6d0ca062865e6d51b72eccdef4467e6a702cdc763d2752fa95e7165","projects/scrapy/bugs/22/setup.sh":"ac53eb0b7d65de4384775c993e7c912179980fb46ec18673385c30a0bd69a6d6","projects/scrapy/project.info":"32e7b621a1df6bf2fa994483d2973c8d5d99b8e72b6c22ee3f6410f736b03c72"},"plan_sha256":"4f1cc5cdcbb6cb7ccb6cf0b2a8af571d0ea01f295b153fd5154b618ed98ebaf2","preparation_manifest":{"path":"evaluation/downstream_benchmark/v6_preparation_plan_manifest_candidate.json","sha256":"3c0a6980360c23f6626863be232fea2878cf13497a74aa2e267594fcf3801b0e"},"protected_manifest_sha256":"fc423a8be5d96e0db41c6bd973d0ab62dac6d38c20880bef7f2da8081501eb9f","python_declared_version":"3.8.3","recipe_sha256":"f511e4f1640334b1223e80556f15d161b71457da5d780e9541b3364ef5c7e8b0","schema":"V6_BASE_PREPARATION_ATTEMPT_IDENTITY_V1","source_mirror":"ABSENT","source_revision_sha":"ABSENT","source_tree_metadata_sha256":"ABSENT","variant":"SOURCE_INDEPENDENT","variant_applicability":["SOURCE_INDEPENDENT"]}}
